,context,question,answerA,answerB,answerC,correct
30000,"During a game of baseball, several players were trying to catch the ball at once, and in that time, Kai broke Casey's arm.",What will Kai want to do next?,call for help,take a break,ignore it all,A
30001,Jan did everything they could to help Aubrey's life.,Why did Jan do this?,So Aubrey could do well,earn more money,get better,A
30002,Riley changed the colors of all his accessories when he changed soccer teams.,What does Riley need to do before this?,see the new colors,get new accessories,retire from the sport,B
30003,Sasha wanted to fight Aubrey so Aubrey did not show up to school again.,What will Aubrey want to do next?,stay home,buy eggs,rent a milk truck,A
30004,Kendall found their purpose in life after attending the workshop.,What will Kendall want to do next?,Be led astray,live her life with meaning,Forget the lessons,B
30005,Jesse went home from school with Taylor so they could study for the big test.,What will Taylor want to do next?,go to school,go home,get all their study materials out,C
30006,Cameron put the little Christmas tree outside so all his friends could put their ornaments on it.,What will the friends want to do next?,decorate the tree with their ornaments,cover it in toilet paper,cut the tree down,A
30007,Sydney lost their opportunity for a hot dinner cooked by Robin when they kept playing their games.,What will Robin want to do next?,For them to eat,set a time limit for games,For them to buy new games,B
30008,Riley looked them straight in the eye and told them about the creature under the bed.,What will Riley want to do next?,see what they say,scare the child in bed,make the child afraid,B
30009,Addison lost her list for the grocery store and has looked everywhere for it.,How would Aubrey feel afterwards?,careless,sad she helped,proud she found the list,A
30010,Kendall impressed upon Remy how important it was to be truthful about everything.,How would you describe Kendall?,disappointed in Remy,rude and uncaring,mature and understanding,C
30011,Jesse developed a concrete plan and thought through the possible options.,Why did Jesse do this?,Figure out the answers on the fly,put the plan into motion,Come prepared to the situation,C
30012,Taylor told their good friend that they loved them a lot.,How would Others feel as a result?,in love,tired,depressed,A
30013,Cameron played games on Skylar's phone and then dropped it in the toilet.,Skylar and Cameron will feel how afterwards?,quite ashamed,very stupid,discouraged,B
30014,Riley saved Jan's life. and his girl friends life.,How would Riley feel afterwards?,riley saved a cat,riley saved a dog,saved Jan's life,C
30015,Austin imposed upon Kai the rules of the prison during their first day of incarceration.,What will happen to Kai?,get free biscuits from Kai,have to learn to follow the rules,bully Kai,B
30016,Jordan was in the back of the line when he spotted Austin. Jordan called out Austin's name from the back.,How would Austin feel as a result?,embarassed,happy,annoyed,B
30017,Tracy always told Jan everything and Jan really appreciated the inside scoop from her.,What does Tracy need to do before this?,and Jan need to be friendly,and Jan need to not talk to one another,tell Jan everything,C
30018,Robin came home early after a disastrous meeting at the plant.,How would you describe Robin?,not good at their job,going to get promoted,likely to get a raise,A
30019,Alex tried to win the race but all he caught was dust from the racers in front of him.,What will Alex want to do next?,take pictures with trophy,practice harder,enter the race,B
30020,Alex saved Skylar the trouble of calling by showing up at her house.,How would you describe Alex?,embarassed,unreliable,helpful,C
30021,Skylar changed Addison's place and cleaned it and it looked much better than it did before.,What will Skylar want to do next?,clean next,be paid next,Make a mess,B
30022,Jesse fulfilled her duties as a nurse well and then retired to become a writer.,How would Jesse feel afterwards?,glad to be finished,like becoming a doctor,like staying in nursing,A
30023,Remy enhanced their understanding of the computer buy explaining how the computer works.,How would you describe Remy?,As someone that bought the computer,As someone that can explain the computer,as smart,B
30024,Skylar needed a new phone after she dropped her old one in the toilet.,How would Skylar feel afterwards?,inconvenienced,klumsy,empty,B
30025,Skylar was stung by a bee because they were hitting the nest with a stick and all the bees got angry.,How would you describe Skylar?,regretful,careful,reckless,C
30026,Carson dug his nails into Jesse's chest when Jesse started swinging at him.,What will Carson want to do next?,laugh at Jesse,subdue Jesse,shout in pain,B
30027,Taylor was very sick and thanked the doctor for Carson's help.,What will Carson want to do next?,just go away home,begin a vitamin regimen,arrange to find a store,A
30028,Sydney aroused Kendall's interests in hopes she would agree to go to the movie with her.,Why did Sydney do this?,did this to be rude,ask Kendall to the cinema,did this to be friendly,C
30029,"After waiting till the day before the project was due, Carson started last night.",How would you describe Carson?,a hardworking individual,irresponsible,prone to putting things off,B
30030,"Taylor had left their phone at home, so Taylor politely asked someone for the time.",What does Taylor need to do before this?,find someone to ask,will tell Taylor the current time,buy a new cell phone,A
30031,Ash was trying to get away from Susan. Ash ran as fast as possible.,What will Ash want to do next?,hide where Susan cannot find them,run after Susan and try to touch them,run after Susan and try to catch them,A
30032,Skylar learned German in college and started to use it.,What will Skylar want to do next?,ignore it,quit the language,speak german,C
30033,Carson made progress on the report that they needed to complete for work.,What does Carson need to do before this?,avoid work,not work on the project,start writing,C
30034,Remy spent all his time playing video games all summer long.,Why did Remy do this?,wait for summer,wanted to have fun,get a video game,B
30035,Cameron studied science for years and now she got an excellent job teaching.,How would you describe Cameron?,very relieved,someone who waste her time,someone who likes to study,C
30036,"Robin saw Taylor all the time, and one day, Robin decided to ask her out.",How would Robin feel afterwards?,excited,sad,dizzy,A
30037,Taylor obtained every prize at the fair this year.,How would you describe Taylor?,very elated,planning to donate the prizes,proud they were able to earn money,A
30038,Robin watched a movie with all of the kids and they were happy.,How would you describe Robin?,maternal,happy,angry,B
30039,"Tracy knew their friend was sad, so they invited them to a party to cheer them up.",How would you describe Tracy?,a person who wants their friends to be happy,Like a neighborly person,go to a party,A
30040,Lee dressed up for Halloween as a scary character from a Horror film.,How would Lee feel afterwards?,Guilty,mad,scared,C
30041,Bailey brought food outside to the animals that were in the barn.,What does Bailey need to do before this?,bring water,Buy food,go inside,B
30042,Sasha won the lottery which was for a jackpot of millions of dollars.,How would Sasha feel afterwards?,happy and excited,stressed and worried,anxious,A
30043,Sydney looked into Robin's eyes and kissed him on the lips.,How would you describe Sydney?,Not an affectionate person,a romantic person,disgusted with Robin,B
30044,Aubrey was so embarrassed when they were caught out stealing that the covered their face with their hands.,How would you describe Aubrey?,proud of themselves,ashamed of themselves,pleased by their actions,B
30045,Robin threw a Tupperware party and wanted to have all their friends over.,How would you describe Robin?,a people person,a loner,unwelcoming,A
30046,Bailey is a store manager. Bailey made Taylor physical inventory count after the thanksgiving sale.,Why did Bailey need to do this?,check the records against the actual stock,prepare for Early Black Friday Sales,wanted to get the store organized,A
30047,Cameron wanted Ash to sleep and told him a story.,Why did Cameron do this?,keep telling stories,asleep,wanted to go to sleep himself,C
30048,Bailey kept the commandments of her religious text because his parents told him to.,What will Bailey want to do next?,abandon his parents,break the law,be a good person,C
30049,Bailey maintained stability at all levels of the gymnastics competition that day.,What does Bailey need to do before this?,fall a lot,lose balance,keep steady,C
30050,Skylar bought a watch for his best friend and they liked it a lot.,What does Skylar need to do before this?,see a watch,buy a beer,buy Skylar a gift,A
30051,Sydney led Riley back home so they can watch a brand new television series.,How would you describe Sydney?,feeling detached,feeling conflicted,feeling great,C
30052,Robin took their date the the movies and then to dinner and they both had a great time.,What will happen to Others?,enjoy the date,ask for a date,get married,A
30053,Robin started school today and the others were very curious about her.,What will Others want to do next?,The others will ask questions next,The others will ignore her next,introduce herself,A
30054,Taylor answered this question with certainty after some long deliberation of it.,How would you describe Taylor?,creative,pensive,confident,C
30055,Jordan ate all of Sydney's food and had to get more because Sydney was hungry.,How would Jordan feel afterwards?,rude,lazy,scared,A
30056,Riley opened up the form because they were expecting a check in the mail.,Why did Riley do this?,send a letter,get some money,check the mail,B
30057,Jordan looked high and low for the missing car keys but couldn't find them.,Why did Jordan do this?,hide the keys,ask if anyone has seen them,leave the house,C
30058,Bailey allowed their dog to run free at a dog park along with other dogs.,What will Bailey want to do next?,leave the house,get a dog,make sure the dog stays in an area where dogs can run free,C
30059,Queen called Carson's mom and told her to come pick him up because he was being mean.,How would you describe Quinn?,guilty,Like a troubled kid,Like a wimp kid,B
30060,Lee rushed upon Quinn's house to throw eggs at it as a prank.,Why did Lee do this?,have fun,annoy Quinn,keep throwing eggs at quinn's house,A
30061,Austin went ahead decided to build Quinn a house.,What does Quinn do after the house is built?,hug Austin for the good deed,destroy the house that Austin built for them,fight Austin for not building a nice house,A
30062,Austin's family has always supported them so he has decided to make their fortunes.,Why did Austin do this?,prepare for the future,Austin's family forced him to,supportive,A
30063,Jan camped with friends after a long week at work where nothing meaningful was accomplished.,Why did Jan do this?,pack for the trip well,recharge,worry,B
30064,Ash smacked Bailey's lips because Bailey was telling mean lies about Ash.,How would you describe Ash?,feeling passive,feeling sad,angry,C
30065,Austin took Cameron's measurements in order to make a suit for them.,What will Austin want to do next?,forget the measurements for a while,start to make the suit,buy a suit,B
30066,Lee gave Kendall an opportunity to improve his grades on the test.,How would Lee feel afterwards?,not grateful at all,Like he was given a chance,like a waste,B
30067,"After many months of discussions and planning for the big date, Austin and Addison made an announcement that they were getting married.",What will Addison want to do next?,get a wedding location,call their parents,get a wedding dress,B
30068,Several clients stated they preferred Jesse's format for the invoices. Taylor begins to use Jesse's format.,Why did Taylor do this?,confuse the clients,make it chaotic,please the clients,C
30069,Aubrey finally went to bed after his mom yelled at him to get off the game.,What does Aubrey need to do before this?,put on the pajamas and turn off the lights,Get found out,double check the alarm clock,A
30070,Jordan gave Taylor the right of way when they were at the four way stop.,What does Jordan need to do before this?,hurt others,want to drive,wabe back after Taylor waves,B
30071,Alex went to a Christmas party and played white elephant. Alex exchanged the gifts.,How would Alex feel afterwards?,a sense of community,all by themself,Fun at parties,A
30072,Remy thought about it for a long time and chose his option carefully.,Why did Remy do this?,decide to think about it,make the right decision,make the wrong choice,B
30073,Sasha's assistance was so helpful that Sydney thanked god for them being there.,How would this make Sasha feel afterwards?,happy that Sydney appreciated their assistance to them,slighted by Sydney for them being overly nice,mad that Sydney was over exaggerating their assistance,A
30074,Taylor gave their daughter a hug after she won the competition.,How would you describe Taylor?,Cruel to her daughter,Reckless,Very loving,C
30075,Alex saw a lion at the zoo after it had escaped from the cage.,How would Alex feel afterwards?,happy,excited,nervous,C
30076,Tracy couldn't get outside to mow the grass since she was sick. Jan mowed Tracy's grass for her.,How would you describe Jan?,a thoughtful person,a uncaring person,a mean person,A
30077,Sydney wrote out their ticket and told them to enjoy the show.,What will Sydney want to do next?,get a job at the theater,get payment from the customers,let others into the show next,C
30078,Robin kept her jacket together with safety pins and paperclips.,How would Robin feel afterwards?,Unkept,felt she should have sewn the buttons back on her jacket,Poor,A
30079,Sydney slid Taylor's hands down her blouse after a romantic dinner.,What will happen to Sydney?,be kissed,go home,Sydney's breasts,A
30080,Robin transmuted her mother's jewelry into gold so that it could be an investment for the future.,What does Robin need to do before this?,clean it,needed to not want any changes to the jewelry,needed to know gold was valuable,C
30081,Jordan gave them something to eat and they got full quickly.,Why did Jordan do this?,loved,bored,take a nap,A
30082,"Sydney didn't know how to look professional for the interview, but Kai helped Sydney with her look.",What will Kai want to do next?,go to the interview,Ask Sydney how it went,thank Kai,B
30083,Alex allowed their parents to enter the building and had a nice long chat.,How would you describe Alex?,feeling loved,feeling bored,feeling passive,A
30084,"Casey saw a sign saying ""no motorbikes"" but decided to ignore it and took his motorbike off road because he really wanted to ride in that area.",How would you describe Casey?,impulsive,proud,courageous,A
30085,Bailey fell in love with Aubrey right from the start when he first saw her.,How would Aubrey feel as a result?,go out and have fun,not do anything together,shy and sad,C
30086,Addison read the newspaper everyday over breakfast before going to work.,Why did Addison do this?,take a few moments to relax in the evening,find out what was happening in the world,drink some juice,B
30087,Robin went to Las Vegas and risked her husbands entire savings account on the roulette table.,How would Robin feel afterwards?,remorse,would ignore her angry husband,would be fine with throwing all the money away,A
30088,Casey looked at Quinn with her eyes because she felt like Quinn wasn't telling the whole truth.,What will happen to Casey after?,break up with Quinn,that they are being judged,uncomfortable,C
30089,Lee was hungry after a long night at work so they ate Alex's breakfast.,How would Alex feel as a result?,upset at Lee,happy with Lee,guilty for eating Alex's breakfast,A
30090,Taylor was driving down the street and got hit by a big car.,What will Taylor want to do next?,bored,get to school,happy,B
30091,"Jan was entered into a local tennis match, so Jan went and played hard.",Why did Jan do this?,were lazy,were bored,were good at tennis,C
30092,Ash sent Addison to a school for troubled children that has a good track record of reforming them.,What will happen to Addison?,be a good parent,learn to do wrong,be reformed,C
30093,Remy and Alex had gone to the beach for a vacation.,What will happen to Alex?,go to a skyscraper,lay on the beach,climb a mountain,B
30094,Tracy wanted to give their partner an apology gift. Tracy gave them a puppy.,What will the partner want to do?,cherish it,spend time with Tracy,forgive Tracy's actions,A
30095,Sasha took their sibling to the library for a reading hour. They were read stories by clowns.,What will Sasha want to do next?,laugh at the funny stories,get their sister ready,leave for the library,A
30096,"Robin let Kai in, but locked the door behind Kai because there was a strange man following them.",What will Kai want to do next?,look out the window,alert the cops,ask Kai what's up,B
30097,The others decided to exclude the new boy but Addison liked everyone and wouldn't go along with it.,Due to this what will the others do next?,take out an ad,accept the new boy,invited the new boy to the birthday party,B
30098,Robin called the pizza company so they could deliver to her.,What does Robin need to do before this?,go to the grocery store,get a taco,order a pizza,C
30099,"Casey's daughter Skylar is ""growing like a weed."" Since she has grown so quickly nothing fits Skylar anymore. Casey says they will need to get Skylar new things.",What will Casey and Skylar buy?,buy clothes and new shoes in a larger size,buy Skylar clothing in the same size,buy Skylar clothing in a smaller size,A
30100,Sydney enjoyed the meal that they had at the restaurant with their friends.,What does Sydney need to do before this?,stay at home,chat with friends,pick out food,C
30101,Taylor went to the store to see if they could buy some bread for their family.,Why did Taylor do this?,be rude,do something nice for someone,drive to the store,B
30102,Sasha wasn't feeling very well and excused themselves from the staff meeting.,What will happen to Others?,ok,throw up in the bathroom,be sent home to rest,C
30103,Tracy packed up the car and headed home for the holidays.,Why did Tracy do this?,be alone for Christmas,be alone for the holdays,spend time with her friends,C
30104,Quinn needed some money so Jan put money in Quinn's bank.,How would Jan feel afterwards?,they lost money,a friend who needed help,they gave Quinn money,C
30105,Austin got full at dinner and was unable to finish the rack of ribs and all of the side dishes he ordered.,What does Austin need to do before this?,go to a restaurant before this,wrap the rest up,go home before this,A
30106,Carson got their friends together to go bowling. They had fun.,What will happen to Others?,she will be happy,Others will think highly of Carson,she will go again,B
30107,Alex assisted his friend in identifying the fruit before they tried something they found in the wild.,What will Alex want to do next?,make a pie,try it,make a smoothie,B
30108,Riley gave Casey a report on the project because she wanted Casey to know what was going on.,What will happen to Casey?,call again,get assigned something,be ignored,B
30109,Bailey gave her friend the opportunity to participate in a raffle to win a video game system.,How would Bailey feel afterwards?,cruel,hateful,caring,C
30110,"Cameron was violent and one day, after making them mad, Cameron broke my leg with the baseball bat.",What does Cameron need to do before this?,Call for help for my broken leg,Apologize for breaking my leg,Find and pick up a bat,C
30111,Kai had finally arrived at their friends house to work on homework.,What will Others want to do next?,spend time with her friend,start their homework,start their class,B
30112,Robin gave Casey a blow horn but Casey did not know how to use it.,What does Robin need to do after this?,learn the blow horn,show Casey how to use it,show Casey how to use the gift,B
30113,Casey got their old shirt out and starting remembering past events.,How would Casey feel afterwards?,good,proud of the past,longing,C
30114,Jesse rang the bell attached to the bedside table at Mercy General and told the nurse that the pain was increasing.,What will happen to Jesse?,The nurse will put the dinner tray on the bedside table for Jesse,The nurse will give Jesse pain medication in the IV attached to the bedside table,discharged from the hospital,B
30115,Ash cannot go home for dinner.  Casey delivered Ash's message to her mother.,What will Ash want to do next?,need to verify the phone number to call,say goodbye to Ash's mother,need to come up with an excuse,C
30116,remy was looking to adopt children and she wanted a certain group of kids.,What will Others want to do next?,keep remy away from the kids,let remy adopt the kids,ignore remy,B
30117,Aubrey bought Casey a pair after she said she loved the new shoes.,How would you describe Aubrey?,friendly,like she mattered,selfish,A
30118,Aubrey thought Jesse was sick because Jesse looked rather pale.,How would you describe Aubrey?,indifferent,concerned,unwell and weak,B
30119,Lee put Cameron's blanked around Jordan without permission because Jordan was cold.,What will happen to Lee?,get yelled at my Cameron,be comfortable,be warm,A
30120,remy was a good citizen of society so he saved austin's life.,How would you describe Remy?,like a good person,as kind,as selfish,A
30121,Carson had gone through a large string of lovers without considering their feelings.,How would you describe Carson?,dismissive of others,jealous of Carson's ex lovers,sensitive to others needs,A
30122,Even though Casey blew Austin off Austin till talked to Casey because they were good friends.,Why did Austin still talk to Casey?,valued their friendship,forgive Casey for that,offered him a bribe,A
30123,Ash kissed on the forehead because he bumped it on the roof.,How would Austin feel as a result?,cared for,mad,guilty,A
30124,Robin shot the bull. She didn't want too but her family needed the food.,How would Robin feel afterwards?,like she did the right thing,uplifted by the experience,like shooting another bull,A
30125,Riley had high blood pressure after eating all the pie.,How would you describe Riley?,gross,a bit sick,happy,B
30126,Casey never gave Cameron respect and then found out how it was to be thought of so poorly.,How would Casey feel afterwards?,kind,ashamed,thoughtful,B
30127,Her mother ignored the apology she had written so Casey wrote another note.,Afterwards how would Casey feel?,Likes to write things down,loved,ignored,C
30128,Carson was hired by Riley to build the website for her new iPhone app.,What will Riley want to do next?,build the website,understand Riley's preferences,launch the app,A
30129,Remy got their exam back and saw that the final score wasn't as good as expected.,What does Remy  to do before this?,Tear the exam up and cry,take the test,complain about the score,B
30130,Skylar put air in ashes car after he passed gas in it.,How would you describe Skylar?,embarrassed at the fact he stank up the car,A caring person,sick to their stomach due to the smell,A
30131,Riley threw away the scraps that were left over from dinner.,What does Riley need to do before this?,gather all of the trash,feed the scraps to the dog,wash the dishes by hands,A
30132,Alex bought Carson's phone and it was really nice.,How would Alex feel afterwards?,Good to have a phone,Like they wish they had one that's nice,excited,C
30133,Skylar was performing at a concert. Skylar played another song.,What does Skylar need to do before this?,practice,play an encore,write a song,A
30134,Lee married his high school sweet heart three times over the years.,What does Lee need to do before this?,marry them again,live happily ever after,plan another wedding before this,C
30135,jan was a sneaky bastard so she took their wallet out to pay.,What does Jan need to do before this?,stay at home,steal the wallet,pay for their friend's meal,B
30136,Kendall lost control of her car quickly when it slid on the icy road.,How would Kendall feel afterwards?,bad at driving their car,worried,happy,B
30137,Skylar dropped her phone in the toilet so she needed a new phone.,How would you describe Skylar?,very careful,frustrated about it,very clumsy,C
30138,Sydney told Remy what had happened and Remy felt bad for Sydney and offered to help.,What will happen to Sydney?,refuse help from Remy,ask Remy to give them space,kind,A
30139,Riley left the store after she stole things.,What will Riley want to do next?,run quickly,escape the store after stealing,leave before the police arrived,C
30140,Kai imposed upon Tracy the rules of the club that Tracy wanted to join.,What does Kai need to do before this?,make sure that Tracy follows the rules,be able to impose the rules,accept Tracy as a club member,B
30141,"Jordan and Alex had become close friends, one day Jordan whispered a secret in Alex's ear and Alex promised never to repeat it.",How would Alex feel as a result?,distrusted,trusted,unsupportive,B
30142,Austin gave Robin a believable reason for why he did not come home last night.,How would Austin feel afterwards?,upset with himself for being untruthful,a good story teller,glad he was able to lie effectively,A
30143,Jordan stayed afloat even though he was falling behind on his bills.,What will Jordan want to do next?,Buy a new car,Quit his job,Reduce his spending,C
30144,Jan met the organization's newest employee and showed her around.,How would Jan feel afterwards?,helpful afterwards,ignored afterwards,upset afterwards,A
30145,Riley faced an uncertain future with a good attitude and good character.,How would you describe Riley?,they were honorable,As someone with character,they were raised right,A
