,context,question,answerA,answerB,answerC,correct
31737,Casey and Ash decided that they should take turns playing each other's roles to see if that worked better so Casey went first.,What will Ash want to do next?,look at what happen,decide to play both roles,play Casey's role,C
31738,"Sydney was always interested in Taylor, he did a background check on Sydney's life, he had all figured out.",What does Sydney need to do before this?,tell Taylor about his interest,move away from tylor,know the truth,C
31739,Tracy went to town with a friend to see a parade.,What does Tracy need to do before this?,pick up their friend,go home afterwards,have a ride to go to town,A
31740,Kendall went out on the lake so she could fish and cast the line into the water.,What will Kendall want to do next?,Catch a mermaid,Reel in fish,find a good fishing spot,B
31741,Carson shuffled the new deck of cards before dealing the hand of poker.,Why did Carson do this?,cheat in the game,know how to shuffel,mix up the cards,C
31742,Sydney looked at their nose and noticed that it was crooked.,How would Sydney feel afterwards?,Dissapointed,worried about appearances,Happy,B
31743,Michael was applying to nursing school and asked Lee for a recommendation letter.,What did Michael need to do before this?,finish the nursing prerequisites,talk to Michael,be there for Michael,A
31744,bailey got over her drug addiction and finally checked out.,How would Bailey feel afterwards?,as fresh,as unchanged,as bad,A
31745,Riley would show for class tomorrow for his report.,How would you describe Riley?,always at school,never on time for anything,nice,A
31746,"Casey recently got a new job, and they loved their new job.",How would you describe Casey?,making good money,happy,at a new job,B
31747,Skylar went to the mall and bought a brand new pair of shoes.,How would you describe Skylar?,like wearing her new shoes,a mall lover,boring,B
31748,Bailey pranked Alex and scared the hell out of him by jumping out at him.,What will Alex want to do next?,needed to plan the prank,get revenge,run and hide,B
31749,Casey tied some sashes together for some people that asked.,How would you describe Casey?,resourceful,cruel,mean spirited,A
31750,Jesse put her clothes onto the table so that she could sort them out.,What does Jesse need to do before this?,go to bed,watch Jesse fold clothes,lay the clothes out,C
31751,"Quinn saw that things were not getting done, so they began to bark orders.",What will Quinn want to do next?,Walk away to cool off,look at the workers,Laugh as if joking,A
31752,Skylar tilted Kendall's head back to whisper a secret so that no one nearby could hear her.,Why did Skylar do this?,did this to be aggressive,did this to have privacy,approach Kendall,B
31753,Lee took Robin out on a date to a movie and also dinner.,Why did Lee do this?,ask Robin if she had fun on the date,show Robin he liked her,go on vacation,B
31754,"After eating Italian food, Cameron annoyed the others by farting a lot and taking medicine.",How would others feel about Cameron eating Italian food?,The others would be annoyed that Cameron ate Italian food,The others would be annoyed that Cameron farted medicine,The others would be annoyed that Cameron farted a lot,A
31755,Ash welcomed Cameron back to the hockey team after they had recovered from surgery.,Why did Ash do this?,have Cameron back on the team,find out Cameron had recovered,make Cameron the star player,A
31756,Skylar gave his son a gift on his birthday and the others were very impressed with it.,What will happen to Others?,be seen as a good parent,watch him open the gift,forget his birthday,B
31757,Addison sets up supplies for the bake sale. They make one table with breads and one with cakes and sweets.,What does Addison need to do before this?,get ready to go home,take down the supplies,bake the bread & set up,C
31758,Robin and their family were going to take a photo. Robin grouped together with their family to make sure they all fit.,How would you describe Robin?,a good person,a sad person,a jealous person,A
31759,"Tracy was waving the knife around carelessly, and Tracy caused Sydney damage.",What does Tracy need to do before this?,go to the hospital,find a knife,call an ambulance,B
31760,Taylor kept their chin up after the accident last week.,How would Taylor feel afterwards?,Like a loser,like a failure,Confident,C
31761,Ash and Sasha were playing hide-and-seek. Ash hid on top of the refrigerator and Sasha couldn't find them.,Why did Ash do this?,wanted to have time alone,wanted to best Sasha,gloat about his victory,B
31762,Cameron ran some tests on Kendall to see what was wrong with them.,What will Cameron want to do next?,analyze the results,needed to talk to Kendall,needed to do a preliminary,A
31763,Tracy wanted to lose some weight and put on more muscle.,What will Tracy want to do next?,eat a cake for lunch,finish exercising,Join a gym,C
31764,Remy rubbed Riley's hands with the hand sanitizer.,Why did Remy do this?,encourage being clean,be dirty,make her sick,A
31765,Lee expressed Sydney his appreciation for being such a good friend.,How would Sydney feel as a result?,angry,annoyed,happy,C
31766,"After they had been dating for years, Aubrey asked Skylar to be their wife.",Why did Aubrey do this?,get divorced,get permission,be married to Skylar,C
31767,"When she went to the rally and heard the racist chants, Remy immediately saw their political party was toxic.",How would you describe Remy?,open minded,motivated to draw attention to the injustice,regret for supporting the party in the past,C
31768,Riley took their new friend to a restaurant to show them how good the food was.,How would you describe Riley?,caring,mean,nasty,A
31769,Addison asked their mom for help when Addison got twisted in the foot at school.,Why did Addison do this?,wanted to mom to know he was away from home,wanted to mom to pick him up to go home,wanted to let mom know he attended the class,B
31770,Cameron loved that he worked with children last year.,Why did Cameron do this?,stay away from people,sleep all day,start teaching more,C
31771,"Amid the pleas and pomp and circumstance, Quinn supported one's decision.",What will Quinn want to do next?,forget about the situation,carried out,know the person well,B
31772,Casey didn't want to try out the experiment for class. Carson conducted Casey's experiment instead.,What will happen to Carson?,get punished,get the bad grade,get the good grade,C
31773,A client hired Austin for investment help. Austin advised the client on all matters.,Why did Austin do this?,study data,was good with money,wanted to marry the client,B
31774,"After being asked for weeks, Lee finally taught Aubrey to play the piano.",What will happen to Lee?,be annoyed with Aubrey's mistakes,become better friends with Aubrey,Play on stage,B
31775,Taylor decorated his Christmas tree for the first time. Taylor was not able to afford Christmas decoration until recently.,What does Taylor need to do before this?,he wanted to celebrate,had to get a job at a tree company,had to get a better paying job,C
31776,Carson went right back to smoking after having quite for two years.,How would Carson feel afterwards?,like running a marathon,instyle with the gang,addicted to nicotine,C
31777,Carson heard Robin sing with a very horrible and shrill voice.,What will Robin want to do after she hears this?,listen to the singing,coach Robin,cover her ears,C
31778,Alex shook Carson's hand slowly and agreed to the deal next week.,What will happen to Alex?,bored,strong,passive,B
31779,Jordan bought a new pair of socks and shoes before the race.,How would you describe Jordan?,unprepared,careless,responsible,C
31780,Austin killed another deer with their car on accident even though they love animals.,How would Austin feel afterwards?,guilty,proud,happy,A
31781,Aubrey carried out their duties as team manager and the project was finished ahead of schedule.,How would Aubrey feel afterwards?,successful,incompetent,inept,A
31782,Ash got a new car and got into an accident the day after he got it.,How would Ash feel afterwards?,upset,excited,glad,A
31783,Jan came home and found a dent in the side of the car. Jan demanded Aubrey's explanation about what happened.,What does Jan need to do before?,come home,buy a car,apologize for it,A
31784,Robin came straight from work and went to the computer to play games.,What will Robin want to do next?,indifferent,bored,proud,B
31785,Kendall improved Riley's quality of life by getting them a new car one day.,Why did Kendall do this?,go for a ride,help Riley,upset Riley,B
31786,Robin wanted to by a new coat. Robin went to Aubrey's store and picked out a coat to purchase.,What does Aubrey need to do before this?,stock the store with products,close up and leave for the day,ask Robin to leave the store,A
31787,Casey made some tea in their brand new tea kettle on the stove.,What does Casey need to do before this?,drink tea,turn on the stove,empty the kettle,B
31788,Taylor had borrowed Alex's bike to go to the store. Taylor left Alex's bike behind when they went inside.,How would Alex feel as a result?,careless,weak,pushed,A
31789,Ash was in a tough spot and decided to borrow some money.,Why did Ash do this?,thank the person for lending them money,give money away,pay for groceries,C
31790,"Sydney gave great manicures, Quinn had Sydney give him a manicure.",How would Sydney feel as a result?,disgruntled,sad,proud,C
31791,Alex got scared on the way home and didn't go alone anymore.,How would you describe Alex?,confident,affected,brave,B
31792,Quinn carried lotion with them and let a friend borrow it.,Why did Quinn do this?,be selfish,get lotion,help their friend,C
31793,Aubrey always thought something was wrong with them and they went to see the doctor every week.,How would you describe Aubrey?,light hearted,optimistic,concerned,C
31794,Jan taught their dog to sit which took a month of training.,How would you describe Jan?,a stupid person,a bad trainer,a good trainer,C
31795,Sasha wanted to lose some weight before their cheer competition.,What will Sasha want to do next?,go on a diet,work out hard,look good in the competition uniform,A
31796,kendall was at the place alone so she put the coat in remy's place.,What will Kendall want to do next?,stand still in fright,yell out for someone,home,B
31797,"After months of persuasion against fellow competitors, Carson finally won Riley over as a client, even gaining his confidence.",What will Carson want to do next?,Just fulfill the basic standard befitting an employee's duties,Judiciously protect the privacy of his client,Boast of his prowess,B
31798,Casey set Remy's papers in order based on the date that they were published.,How would Remy feel as a result?,like Casey was a nuisance,like Casey was organized,like Casey was messy,B
31799,Alex lived and let live so that they could live peacefully with other members of society.,How would Alex feel afterwards?,at odds,easy-going,lerant,B
31800,"After turning in the paper late, Tracy skated on thin ice.",What will Tracy want to do next?,finish the paper,that the teacher owes her,make up for her bad effort,C
31801,Skylar was the best singer in the group. Kendall imitated Skylar's example.,How would Kendall feel afterwards?,works hard at practicing their vocals,trying to be as good of singer as Skylar,shy,B
31802,Jan was tired of putting up with all the drama at work.,How would Jan feel afterwards?,annoyed,depressed,happy,A
31803,Billy waved at Kendall and Kendall waved back.,What will Billy want to do next?,chat it up,ostracize Kendall,rectify Kendall,A
31804,Ash was driving home and notice Riley struggling along the sidewalk with large bags of shopping so Ash stopped and offered Riley a lift.,What will Ash want to do next?,make room in the car for Bailey,slow down,not make room in the car for Bailey,A
31805,Austin observed the seed every day in the morning in the little pot.,Why did Austin do this?,wanted to kill the tree,wanted to see how it grew,wanted to destroy the seed,B
31806,Jan put the pillow on the bed and then swept the floor and put away laundry.,What does Jan need to do before this?,want a tidy home,ignore the mess,take a nap,A
31807,After keeping the secret from everyone at the office for years. Jan finally got it off her chest and told Casey's coworkers about their divorce.,How would Jan feel afterwards?,relieved not to have to keep the secret,a gossip,very careless,A
31808,Tracy asked Austin's family if he could get permission to marry their son Austin.,What will happen to Tracy?,marry Austin's family,get engaged,be rejected by the family,B
31809,Quinn returned from an hour long marathon and smelled bad to those around him.,How would you describe Quinn?,they need to take a shower,preparing for a marathon,A person who likes to be lazy,A
31810,Remy was nervous about her new relationship so REmy asked Tracy what she thought.,Why did Remy do this?,get out of the relationship,get advice,wanted to brag,B
31811,"Ash tried to be cautious, but Ash wore their heart on their sleeve.",How would you describe Ash?,o generous,Vulnerable,Cranky,B
31812,Casey met their future spouse at a bar. It was an odd place to find them.,What does Casey need to do before this?,say goodbye,not say anything,introduce themselves,C
31813,Quinn had a good summer vacation but it was coming to an end. Quinn returned to college in the fall.,What does Quinn need to do before this?,needed to be enrolled in college,finish their course,needed to be starting his vacation,A
31814,"Tracy asked Lee to give them a break, so they can do something fun over the weekend.",What will Tracy want to do next?,go to the movies with them,stay home all weekend,play cards in her bedroom,A
31815,Taylor increased Kai's efficiency at school buy teaching them good study habits.,What will happen to Taylor?,get talked about,hope Kai does well,study hard,C
31816,Kai blew on the scalding bite of food on his fork to kingdom come.,Why did Kai do this?,eat scalding hot food,cook the food,make sure he wouldn't get burned,C
31817,Addison found Casey's watch around the corner at the store after it had been missing for days.,What will Casey want to do after?,give the watch to the clerk,wear the watch,throw it away,B
31818,Riley had just had an operation to replace their knee.,What will Riley want to do next?,sit down and rest,try to run,jump up and down,A
31819,Ash used an x to represent the treasure and showed the map off to the others.,How would Others feel as a result?,The others would be mystified at the treasure,The others would be wanting to dance,smart,A
31820,"It was time for everyone to pitch in for the rent bill, Cameron was told Tracy would take the money.",What will Cameron want to do next?,give the check to Tracy,did this for clarification,talk to Tracy about rent,A
31821,Austin was asked to speak at a meeting. Austin put her best foot forward.,Why did Austin do this?,only meet the minimum,decide how to run the meeting,make a good impression,C
31822,Jordan created consumer awareness and positive comments by posting uplifting messages on social media.,Why did Jordan do this?,create goodwill in the community,needed to conceive the messages,needed to log in social media account,A
31823,Bailey went to the concert and saw the band live.,How would Bailey feel afterwards?,full of energy because she had a great time,angry because she didn't perform,sad because she didn't perform,A
31824,"After reviewing Remy's new policy, Sydney decided to make some changes.",What will happen after Sydney finishes the changes?,follow Remy's lead,pass around the new policy,tell her boss the changes,C
31825,Riley started drinking the soda after getting it from the machine.,What does Riley need to do before this?,brush her teeth,eat healthier foods,pay for the soda,C
31826,Kai saw their friend Lee crying in the park earlier today and came to their rescue.,How would Kai feel afterwards?,Feel special to her,enjoys helping others,has no friends,B
31827,Cameron wanted to start a business in a new field as soon as possible.,What does Cameron need to do before this?,go to school,nothing,study new fields,C
31828,sydney got a reward for popping baloons at a fair.,How would Sydney feel afterwards?,sad she couldnt get enough balloons to get a bigger reward,tired from all the popping,happy she got a reward,C
31829,Ash used his positive influence to support his teammate during the project development stage.,How would Ash feel afterwards?,awkward,ashamed,accomplished,C
31830,Cameron renewed their vows yesterday after ten years of marriage.,How would Cameron feel afterwards?,like a loved person,like a hateful person,like an apathetic person,A
31831,robin found a roach in the pizza and therefore called the pizza company.,What will Robin want to do next?,start to eat the pizza,gladly eat the pizza,complain about the pizza,C
31832,"Since their college was closing for summer break, Jesse went home last week.",What does Jesse need to do before this?,take their final exams,Relax at home,Visit friends,A
31833,Tracy left the party after realizing she had to be at work early in the morning.,What does Tracy need to do before this?,go to a party before this,set an alarm for the morning,go to bed as soon as possible,A
31834,Jesse was hoping that she would receive a gift in the secret santa exchange.,How would you describe Jesse?,excited that she has no presents,sad that she didn't get anything from the party,Happy,C
31835,"Since Skylar was very busy with the meeting, Cameron asked if she could use Skylars phone to play games while she waited for Skylar.",{}?,done with the games,be on good terms with Skylar,thank Skylar for letting her use the phone,C
31836,Jan happened to pay attention and seen every variable and different thing.,What does Jan need to do before this?,needed to know what she was looking at,needed not not pay attention to the event/speech,needed to be a 1st timer at the event,A
31837,Taylor enjoys their new job. Taylor takes time to blow away the leaves before starting to cut the grass.,How would you describe Taylor?,now a front desk rep,a lawn care person,hired as a secretary,B
31838,Riley applied the reading techniques to the study of science to help them learn.,What does Riley need to do before this?,help the students,make the assignment clear,want to learn science,C
31839,Kendall found a new job and wants to start as soon as possible.,What does Kendall need to do before this?,go on vacation before she leaves,call in sick at her current job,finish up her current projects,C
31840,Robin's girlfriend liked what she was seeing when it came to Jordan.,How would you describe Jordan?,a lazy person that only looks out for themselves,a nice and caring person that will do anything for people,lust,B
31841,Casey broke Cameron's kiss while they were on their date.,How would Cameron feel as a result?,affectionate,hurt,intimate,B
31842,"Addison received detention after the fight, even though they were not the one who initiated the fight.",How would you describe Addison?,A person who was trying to bully someone,annoyed,A person who was trying to defend themselves,C
31843,It was a long walk to Addison's house so Sydney met Addison halfway.,What will Sydney want to do after?,greet Addison,walk less,punish Addison,A
31844,Aubrey sent text messages to all of her friends.,What will Aubrey want to do next?,not reply,ignore the texts,make plans with her friends,C
31845,"Ash needed a few extra things and had to stay home, so they sent their son to the store.",How would Ash feel afterwards?,relieved that the son came home safely,excited about meeting a friend at the store,would be annoyed about having to go to the store,A
31846,"Carson wore their helmet, which save their life when they fell off the bike.",What will Carson want to do next?,buy the helmet,make sure the bike isn't ruined,make sure the car isn't ruined,B
31847,Addison got on with their work after taking a break.,What will Addison want to do next?,make sure they didn't fall behind,do good work,stay vigilant and complete their tasks on time,C
31848,"Jordan had a handful of lottery tickets, and gave Taylor the right one to win the jackpot.",What will happen to Taylor?,Have more money than before,jealous they gave Taylor the ticket,Buy more lottery tickets next time,A
31849,Jesse immediately took it even though Others had really wanted it.,What will happen to Others?,be impressed with Jesse,praise Jesse for taking it,be upset at Jesse,C
31850,Casey asked his friend if he wanted to go to the store with him.,What will Casey want to do next?,rent a car,buy a boat,go to the store,C
31851,"The setting was beautiful, a pasture with lots of wildflowers, an angel came unto Robin and Ash there.",What will happen to Robin?,go out for breakfast,run screaming,be at peace,C
31852,Sydney made it special for him and he really appreciated all the effort that was put in.,How would you describe Sydney?,very cold to others,annoyed at others,a very caring person,C
31853,Addison practiced piano every day for three hours.,What will Addison want to do next?,Sign up for piano lessons,play softball,join the school orchestra,C
31854,Kai used binoculars to watch them up close through their bedroom window.,How would you describe Kai?,a serious person,a tom cat,a creepy person,C
31855,Kendal proved every person wrong when he demonstrated a machine at work.,What will Kendall want to do next?,quit his job,find a new job,get a promotion,C
31856,Kai sent his assistant to help.,Why did Kai do this?,let everyone know his assistant would help,kai calling his assistant for help,ki called father for bathroom,A
31857,Sasha wanted a shower as soon as they arrived so Robin unpacked Sasha's things.,What will Sasha want to do next?,thank Robin for helping,take out sasha's thing,leave Robin's home forever,A
31858,Lee mixed the ingredients for the pie in the big kitchen.,Why did Lee do this?,make a pie,fry an egg,cook some ham,A
31859,jesse was bored so he saw if he could help the person out.,How would Others feel as a result?,as thankful,caring and kind,as ungrateful,A
31860,Jordan wore socks instead of just wearing sandals to the party.,How would you describe Jordan?,normal,eccentric,like a stupid person,B
31861,Jan considered the clues separately while they were solving the puzzle.,Why did Jan do this?,find each one of the clues to the puzzle,ruin the clues,be careful,C
31862,Skylar broke up with Tracy's girlfriend for him because he was too scared.,How would Tracy feel as a result?,relieved to not have to do it,a good mediator,angry at Skylar,A
31863,Sydney had been dating Taylor for a while now and they tried to kiss Taylor.,What will happen to Sydney?,kiss back,fall asleep,say that they love Taylor,C
31864,Addison layered the groundwork for the house that was being built.,How would Addison feel afterwards?,very accomplished,like they don't know what to do,involved in building a house,A
31865,Jesse shared Jordan's love by getting some good coffee and good pizza.,What will happen to Jesse?,loved,lazy,bored,A
31866,Addison borrowed a book from a friend and then returned the book that evening.,What does Addison need to do before this?,burn the book,ask to borrow the book,throw the book away,B
31867,Alex stopped to get a sandwich at the rustic sandwich parlor.,What will Alex want to do next?,Make his order,throw away the sandwich,eat food,C
31868,Taylor went out and got their grandmother a gift for their birthday today.,What will happen to their grandmother?,give their grandmother the gift,open the gift,eat a birthday cake,B
31869,Cameron tied Lee's shoelaces together as a prank.,What will Cameron want to do next?,make people laugh,annoy Lee,watch and see what happens,C
31870,Addison made Austin act in the play for the next few weeks.,Why did Addison do this?,rehearse with Austin,teach Austin lines,smart,A
31871,"Alex had to stay late and missed the school bus, so Alex walked home from school one day.",How would Alex feel afterwards?,rejuvenated,hilarious,worn out,C
31872,Adeline was applying to nursing school and asked Lee for a recommendation letter.,What did Adeline need to do before this?,finish going to medical school,write the letter for Adeline,do good work for Lee to impress them,C
31873,Aubrey took Lee to the park because it was a nice day outside.,What does Aubrey need to do before this?,tell people it's nice out,enjoy the day,drive to the park,C
31874,bailey considered the offer seriously and accepted it after a few days.,What will Bailey want to do next?,change careers,rich,bored,A
31875,Skylar went with friends to watch their most anticipated movie which they enjoyed very much.,How would you describe Skylar?,very impatient,a social person,a movie addict,B
31876,Addison saw their aunt at the store.  She was trying to buy a birthday gift for Addison and it would have been a surprise gift.,How would Others feel as a result?,having a little bad luck,feeling awkward,surprised to see Addison,B
31877,Cameron affected students' life by teaching how white people genocide American Indian.,How would you describe Cameron?,a white person who killed American Indian,a white person who denies genocide,a person who accepts the reality,C
31878,"Remy had thought the drive was longer than expected, so Remy arrived five minutes early.",What will Remy want to do next?,use his phone,regret the free time,be punctual,A
31879,Ella was applying to nursing school and asked Lee for a recommendation letter.,What did Ella need to do before this?,finish going to medical school,get into the school,do good work for Lee to impress them,C
31880,carson was a good man so he invited bailey's friend addison over.,How would Carson feel afterwards?,normal,weird,uptight,A
31881,Jesse fixed it right away when they noticed that it was broken.,How would Jesse feel afterwards?,uspet,useful,hurt,B
