,context,question,answerA,answerB,answerC,correct
32465,Ash complied with Jesse's request because they wanted to make sure they understand.,How would Ash feel afterwards?,very fair,awkward,happy,A
32466,Jan wanted pancakes for breakfast so she headed to the nearest diner.,Why did Jan do this?,enjoy a big breakfast in the comfort of home,go with Jan,enjoy a big breakfast without making a mess,C
32467,Taylor persuaded the family to adopt a son even though they already had many children.,How would you describe Taylor?,Joyful,someone who does not want kids,someone who cares for children,C
32468,Remy took a licking and kept on ticking and went to school with a black eye.,How would Remy feel afterwards?,like a proud loser,resilient and continues goals even after taking a licking,embarrassed and beat up,C
32469,Quinn had too much to drink the other night. They were starting to have a problem.,What will Quinn want to do next?,stop drinking,have fun,go out and party,A
32470,Robin found their peace in the words that were written in the book.,How would Robin feel afterwards?,Glad they read the book,contemplative,religious,A
32471,Carson started his lawn mower but it was out of gas.,What will Carson want to do next?,Pour it in,wanted to mow the lawn,Reach for gas can,C
32472,Cameron asked Casey to write home and tell her how she was doing.,How would Casey feel as a result?,know how Casey is,interested in how Casey is,would be happy to have good friends,C
32473,Kai grew quickly after eating right and working out.,How would Kai feel afterwards?,confident and attractive,smaller and weaker,not confident and ugly,A
32474,Cameron wore shorts often even during the cold weather seasons.,What does Cameron need to do before this?,buy new shorts,take a hot shower,have a pair of shorts,C
32475,Skylar decided to hire a tutor for her daughter because she was failing at math.,How would Skylar feel afterwards?,a good mom,relieved,smart,A
32476,Austin was bored one night and had nowhere to go. Austin sat on the couch and watched a movie on TV.,What will Austin want to do next?,turn on the TV,find a movie to watch,lay down,C
32477,Cameron climbed the fence to get the ball he threw over by accident.,How would you describe Cameron?,boring,daring,lazy,B
32478,Aubrey challenged Tracy's friends to a game of hide and seek for an hour.,How would Aubrey feel afterwards?,lazy,passive,sneaky,C
32479,Sydney really liked Skylar and was trying very hard to become Skylar's girlfriend.,What will Sydney want to do next?,send flowers to Skylar,flirt with the clerk at the ice cream parlor,insult Skylar,A
32480,Kai kept their nose clean while they had a cold and runny nose.,Why did Kai do this?,spread the disease to others,get their nose pierced later,prevent others from getting sick,C
32481,Ash took their pic with the president after his tour of The Whitehouse.,How would Others feel as a result?,an amateur photographer,enjoying his vacation to DC,envious of Ash,C
32482,Riley played chess with a group of people in the park.,What does Riley need to do before this?,like playing chess,stay at home,win a game,A
32483,Sasha accomplished her objectives for the semester.,What does Sasha need to do before this?,she wanted to get it done,she wanted to graduate,Study hard,C
32484,Robin was crying because she just heard that she would be losing her job but Kai was there to wipe away her tears.,How would you describe Kai?,selfish when dealing with his friend,better if someone dried her tears,concerned for his friend Robin,C
32485,Robin had a way with speaking that helped them to motivate people and improve their lives.,Why did Robin do this?,hurt others,make others' lives worse,make others' lives better,C
32486,Riley protected their skin from the sun and had a good time at the park.,Why did Riley do this?,lazy,go home,strong,C
32487,ash was bored so she told sydney a secret.,How would Sydney feel as a result?,as shocked,as calm,as bored,A
32488,Aubrey was in a hurry and go the food to go.,What will Others want to do next?,make sure she isn't hungry,think she should have a meal,they didn't have time,A
32489,Sasha was driving down the road too fast in bad weather conditions.,How would you describe Sasha?,reckless,conservative,nervous about it,A
32490,Jan ran out of supplies for their baby. Quinn bought what Jan needed.,How would you describe Quinn?,emotional towards Quinn,a person who wants a baby,someone who cares for others,C
32491,Jan needed to go quick and was thankful to make it to the bathroom in time.,How would Jan feel afterwards?,relieved afterwards,pressure afterwards,was happy to find a bathroom,A
32492,"Riley wanted to tell Alex important news.  Instead of calling, Riley decided to see Alex in person.",How would Alex feel as a result?,excited,that it was nothing special,that it was exciting,C
32493,Riley saw what Sasha was having for dinner and stared jokingly with Jealous eyes.,What will Sasha want to do next?,Make Sasha laugh at them,make a joke about Riley's dinner,discuss what Riley said,B
32494,according to the article Tracy asked Austin's family over for dinner.,How would you describe Tracy?,excited about the upcoming meal,family person,anticipating of the upcoming dinner,A
32495,Cameron was the lead in the church choir and Cameron sung the praises of the Lord.,What will Cameron want to do next?,Prepare,Sleep,Quit,B
32496,"Many months after the accident, Austin finally left the hospital today.",How would Austin feel afterwards?,Sad,Happy,Regretful,B
32497,"After they broke up with their boyfriend and lost their job, Aubrey moved back home to live with their parents.",What does Aubrey need to do before this?,pack up all their belongings,invite their parents to move in,get hired for a new job,A
32498,Carson took in Aubrey's sense of style.  Aubrey helped Carson to dress properly.,What will Carson want to do next?,become stylish,borrow more clothes,copy them,A
32499,Lee flew back home but needed to make sure their parents would be around to visit.,What does Lee need to do before this?,avoid their parents,call their parents,ask if their parents will fly out,B
32500,Sydney gave ash grief. Sydney was Ash's daughter and was making bad grades.,What will happen to Sydney?,Sydndey will be held back,fail a grade,work harder,A
32501,Sasha downloaded the app and played the game all the time.,What will happen to Sasha?,hate the app,play as well,have a problem,C
32502,Kendall thanked Sasha in an email for Lee's help with the project at work.,How would Sasha feel as a result of the email?,pleased and proud,embarrassed and ashamed,annoyed and taken advantage of,A
32503,Ash moved Cameron only an inch during the wrestling match.,What will Ash want to do next?,celebrate their win in the match,win the match,fight harder in the match,C
32504,Carson liked the sound of their own voice and rambled on all day about things that nobody cared about.,How would Others feel as a result?,a person who likes to talk,annoyed,entertained,B
32505,"Lee had caught Carson in a lie, so Carson tried to provide Lee with an explanation.",What will Carson want to do next?,get Lee to forgive them,not trust Carson,become angry with Carson,A
32506,Casey got Jan's trash to throw away in order to help Jan out as a friend.,How would Jan feel as a result?,happy to be helping the environment,good that he helped his friend,kind,A
32507,Addison even hired her enemy. She knew that this would not be well taken.,How would Addison feel afterwards?,uncaring,whimsical,loving,B
32508,"Remy was one of about 100 applicants, and yet he managed to get the job.",How would Remy feel afterwards?,unemployed,"Bad, they skipped him over","Great, he was chosen",C
32509,Aubrey went to her friend Cameron's house to bring her a present.,What will happen to Cameron?,be happy,be mad,be sad,A
32510,"Aubrey wanted to know the price of the specials, so Aubrey asked the waitress a question.",What will happen to Aubrey?,break a plate,scream at the waitress,order the special,C
32511,"Tracy had a long vacation.  Therefore, they stayed here for a few more days.",How would Tracy feel afterwards?,relaxed,anxious,uncertain,A
32512,Jordan spent a night in jail after something horrible and regretting it.,What will Jordan want to do next?,say nothing,cry quietly,break the law,B
32513,Casey decided to go to his brother's graduation this weekend.,Why did Casey do this?,get his diploma,be a good brother,dress nice,B
32514,"For his 21st birthday, Sasha took him to vegas.",What will Sasha want to do next?,relax at home,celebrate in bars,watch TV,B
32515,Carson sent Tracy's furnishings to a shelter as donations.,Why did Carson do this?,ask Tracy about it,help,get the furnishings,B
32516,Kendall sat down with Remy and impressed upon her to tell the truth.,Why did Kendall do this?,make things okay,make things bad,arrange privacy,A
32517,Jan made a popular song. That song is now famous.,What does Jan need to do before this?,write lyrics,become rich,give it no mind,A
32518,Sasha had worked very hard for the upcoming competition. Sasha won another award.,What does Sasha need to do before this?,be lazy,practice,forget about it,B
32519,Bailey saw sirens in her rear view mirror. She had just robbed a bank. Bailey hit the gas pedal in an effort to get away.,What did Bailey do?,stepped on the gas to get away,scared and on the run,turned herself into the police,A
32520,Sasha completed all of the objectives for the class perfectly with plenty of time to spare.,How would you describe Sasha?,very rushed,had felt proud,very quick,C
32521,Carson prevented Sydney from reaching their goal of winning against them at chess.,What will Sydney want to do next?,Ask to play again,Defeat their opponent,talk about playing chess,A
32522,"Despite having a restraining order against them, Jordan came near Quinn.",What will happen to Quinn?,be filled with bread,gasp in fear and surprise,get arrested,B
32523,Addison looked in his friend's wallet.,Why did Addison do this?,wanted a corkscreu,was looking for his friend's ID,needed a map,B
32524,Ash played tricks on his little sister to make her cry.,Why does Ash do this?,be a good brother,play with her,powerful,B
32525,"Alex returned Skylar's attention to the task at hand, mopping the floor.",Why did Alex do this?,play on their phone,trash the house,have a clean house,C
32526,"Riley had been watching too much television, so Kai limited Riley's use.",What does Kai need to do before this?,Notice how much Riley watches,make Riley better off,Buy a new television,A
32527,Kendall was too shy to ask Aubrey on their own.,How would Kendall feel as a result?,nasty,enraged,relieved,C
32528,Quinn had been feeling tired and sluggish and wanted to feel better.,How would Bailey feel afterwards?,concerned about Bailey,very helpful,ashamed of self,B
32529,Jordan was supposed to bring the wallet with them but it slipped their mind.,How would Others feel as a result?,forgetful,furious,disappointed,B
32530,Tracy called the class back in after she got ready for the testing session.,How would the class feel as a result?,angry for being kicked out,ready for the test,ready for lunch,B
32531,Ashe had a great time at Jesse's party getting to know everyone.,How would you describe Ash?,tired and happy,happy to have made new friends,social,C
32532,Alex told Taylor the way they needed to go to get to the goal.,How would you describe Alex?,a leader,get a map,hopeful that Taylor can perform,A
32533,Austin heads up an IT team for a major company.,Why did Austin do this?,Get a college degree,was surprised the team succeeded,was going to quit,A
32534,Quinn owned a new car.,What will Quinn want to do next?,needed a vehicle for work,Quinn's old car died,Get good insurance,C
32535,"Quinn was a decorated war hero, and all the soldiers in the squad trusted them, so when the war began, Casey followed Quinns lead to battle.",Why did Casey do this?,be a good leader,keep being good,wanted to survive the war,C
32536,Addison stopped trying to figure out the problem.,What will Addison want to do next?,did this out of frustration,look up the answer,quit,B
32537,Remy's shed was deteriorating so they tore it down and reduced the shed to rubble.,What will Remy want to do next?,clean up the rubble,go into the shed,not try hard,A
32538,Kai wrote a letter to his mom today who he has not seen for many years.,How would Kai feel afterwards?,as ordinary,very nostalgic,as normal,B
32539,Tracy issued Riley the court's order after the child support hearing.,What will Riley want to do next?,tell Tracy to leave,disown the children,accept their responsibility,C
32540,Jason was applying to nursing school and asked Lee for a recommendation letter.,What did Jason need to do before this?,finish going to medical school,give Lee a job interview,finish the nursing prerequisites,C
32541,Jordan put Bailey's new facebook account online for them.,What does Jordan need to do before this?,know Bailey's account,put in the information,thank Jordan for the help,B
32542,Jan blinked several times after she heard what her brother said.,What will Jan want to do next?,let it sink in,laugh,frown,A
32543,Ash tossed the leftover bones aside and had to go to sleep for work.,How would Ash feel afterwards?,good,hard working,bored,A
32544,remy sat quietly in my coffee shop thinking about their decision of what job to choose.,What will Remy want to do next?,fail the plan,drive to the coffee shop,execute the plan,C
32545,Austin rode a bike on a beautiful mountain range.,How would you describe Austin?,refreshed,lazy,exercise-minded,C
32546,Austin and Cameron went out to dinner and each ordered a meal. Austin finished his meal and Cameron did not. Austin asked Cameron if he could finish his meal.,How does Cameron feel after Austin asked him the question?,disgusted because Austin eats too much,more food to share,sick because they now have food poisoning,A
32547,Kendall always brought drinks for her friends because she made the most money.,How would you describe Kendall?,friendly,broke,weak,A
32548,Cameron got up on the wrong side of the bed after staying out way too late the night before.,How would Cameron feel afterwards?,that Cameron was out too late,meeting the inlaws for lunch at noon,like taking a nap at the desk during work,C
32549,Carson chipped Quinn's tooth with a hammer by mistake and immediately started apologizing.,What will Carson want to do next?,make it up to Quinn,have Quinn chip his tooth,warn Quinn to apologize,A
32550,Carson waited months to go back to camp and finally go to go.,How would Carson feel afterwards?,annoyed,excited,bad,B
32551,Aubrey decided to take a chance on betting on the game.,Why did Aubrey do this?,wanted to have some fun,wanted to get rich,wanted to get wealthy,B
32552,Addison identified an asset at risk of failure and found a way to fix it.,What will Others want to do next?,look for risks,think about the risks,thank Addison for their hard work,C
32553,Tracy gave Carson's developmentally delayed baby a kiss and the baby finally said it's first words.,What will happen to Carson?,be jealous of the baby,guilty that it was her and not Carson,be jealous of Tracy,C
32554,Jan sat the food on the table and then started to ring the bell for dinner.,What will Jan want to do next?,begin passing out plates,prepare the meal,cook the food,A
32555,Kai got the dirty water off his chest with a sheet of newspaper.,What will Kai want to do next?,find a newspaper,go to work,jump in the lake,B
32556,"Casey is performing as a singer at a nightclub. Sasha is Casey's friend and visited the club to see Casey perform. After the performance, Casey met with Sasha backstage.",How would Sasha feel as a result?,bored and discontented,relieved that Casey finished her performance as she met with Casey after the show,talented,B
32557,Sydney wanted to stop for lunch even though they had eaten only two hours earlier.,How would you describe Sydney?,never hungry,like she ate too much,a greedy person,B
32558,Casey made headway and got a leg up on their competition for a while until they eventually lost the tournament.,What will Casey want to do next?,wanted to win the tournament,train harder,get lazy,B
32559,"Alex was an ugly man, four hundred pounds overweight with boils and warts coating his body.",How would you describe Alex?,a catch,gross,unattractive and undesirable,B
32560,Taylor was being mean to Skylar and pressed his hand onto his book.,What will Skylar want to do next?,Yell at Taylor,punch Skylar,hurt Skylar,A
32561,Riley's assignment was due tomorrow so she had to get to work.,What does Riley need to do before this?,ignore the assignment,get ready for the assignment,go play outside,B
32562,sydney did something terrible so she dropped to carson's knees.,How would you describe Sydney?,glad to get things off their chest,eager to get Carson's forgiveness,as distressed,B
32563,Taylor played video games for hours and then went to bed so he can play more later.,How would Taylor feel afterwards?,good,As someone who likes video games,bored,A
32564,Quinn finally agreed to the contract to mow the teacher's lawn for the summer.,What will happen to Others?,proud,The other students will pitch in wire to help him lose his lawnmower and the job,The other students will have to just go find work elsewhere since he got the job,C
32565,Aubrey stood next to Cameron and was happy he noticed her.,How would Aubrey feel afterwards?,upset afterwards,offended afterwards,complimented afterwards,C
32566,Kai saw a doctor. She had been putting it off out of fear of bad news.,What will Kai want to do next?,disregard the results,Prepare herself for whatever the doctor says,prepare for the test results,B
32567,Sasha knew she was being watched but she stared straight ahead and didn't acknowledge it.,How would Sasha feel afterwards?,lucky,uneasy,determined,B
32568,Quinn looked Bailey in the eyes when they said something silly to them.,What will Quinn want to do next?,make their friend laugh,make it seem serious,not let on that it's a joke,A
32569,Sydney was responsible for cropping all photographs submitted by clients.,How would you describe Sydney?,argumentative,mean,competent,C
32570,Kendall put their food in the trash and then left the area as quick as possible.,Why did Kendall do this?,throw something away,get into a fight,wash the dishes,A
32571,Kai bent every rule. He paid the price for it though when he was caught.,How would Kai feel afterwards?,like a smart person,daring,guilty,C
32572,"After a long grueling semester, Tracy took the final exam and finished their course today.  Now they would graduate.",Why did Tracy do this?,complete their degree on time,need to be smart,get praised for the job they were doing,A
32573,Sydney saw her house for the first time since the fire.,How would Sydney feel afterwards?,like it's more than she deserves,pleased by the improvements,that it took too long to complete,B
32574,Tracy gave Carson's baby a smile after the baby smiled at it.,What will happen to Tracy?,proud,giggle,go on with their day,B
32575,"Even though Robin was having difficulties with their partner, Robin fought hard to make it work for the sake of the family so that they will stay together.",What will Others want to do next?,Do not follow in Robin's footsteps,Follow in Robin's footsteps,Criticise Robin for their hard work,B
32576,Tracy spent too much time on the english grade and forgot about her math homework.,How would you describe Tracy?,overwhelmed,capable,in cotrol,A
32577,Sydney put it on the table though Sydney was told not to put it there by their parents.,Why did Sydney do this?,ignore what their parents said,listen to their parents,be an obedient child,A
32578,Robin brought the convict to trial and prepared to begin to make her case.,What will Robin want to do next?,win the case next,robin would need to ge ta law degree,resign next,A
32579,Jesse brought home a cat that they found in the park.,How would Jesse feel afterwards?,nurturing,Like they should know the owner,Like they wonder who's it is,A
32580,Jesse sent lunch instead. The others in the office were very grateful to Jesse for her help.,What will Others want to do next?,Thank Jesse,do a good deed,forget about it,A
32581,Kai was telling Fibs so Syndey looked Kai in the eye to see if they could catch them out.,How would you describe Sydney?,Distrustful,Resentful,curious,A
32582,Sydney changed Tracy's way of finishing the project and it resulted in a lot more productivity.,Why did Sydney do this?,alter Tracy's method,review Tracy's method,wanted quicker results,C
32583,Casey walked up to the bench after the judge named Bailey said to come over.,What will happen to Bailey?,quit their job,walk home immediately,deliberate the info,C
32584,Taylor set their guests at ease about why they were their.,Why did Taylor do this?,think about enjoying themselves,Arrived at their location,So they could relax,C
32585,Bailey wanted Aubrey's parents to visit the park with them that day.,What will Bailey want to do next?,greet them,tell them to leave,ignore them,A
32586,Casey was new at school and sat by herself. Sasha walked over and became Casey's friend.,What does Sasha need to do before this?,talk to friends,make a new friend,talk to Casey,C
32587,Austin bought snacks so he could eat during the movie.,How would Austin feel afterwards?,not hungry,a movie lover,good at thinking ahead,C
32588,Cameron licked their face because they were covered in honey.,How would Cameron feel afterwards?,sad,satisfied,depressed,B
32589,Kai was upset at a child who took his art project. Kai pushed a child on the ground.,Why did Kai do that?,yell at kai,tell kai that it was wrong,wanted to get his project,C
32590,Lee wanted a refill on his sweet tea so Lee flipped his lid.,What does Lee need to do before this?,be at work,be at home,have a cup,C
32591,Carson was discovered hiding in the wardrobe by Lee. Carson provided Lee with an explanation.,What does Carson need to do before this?,think of what to say,yell at Lee,leave the wardrobe,A
32592,"It was after hours and the library was closed, so Riley gave himself access.",What will Others want to do next?,drink in the library,call the police on Riley,steal books,B
32593,Bailey drove way too fast around town and it scared everyone.,What will Others want to do next?,make a report,get a driver's license,praise her driving,A
32594,Bailey would make it up after knowing the suffer of the opponent.,How would you describe Bailey?,Lucky,Guilty,considerate,B
32595,Sydney looked Kai in the eye very carefully.,How would Sydney feel afterwards?,scared,Soft spoken,Aggressive,B
32596,Quinn spent a lot of money with the Kai family and then proposed to her.,What will happen to Kai?,be mad,get married,not be hppy,B
32597,Addison got good grades while attending college last year.,How would Addison feel afterwards?,proud,upset,bad,A
32598,Carson felt tender feelings for Jesse and wanted to get closer to them.,How would Jesse feel as a result?,offended,loved,disgusted,B
32599,according to the article Carson rose from Quinn's seat.,How would you describe Carson?,a caring person,glad for the seat,like taking a nap,A
32600,Aubrey was playing football with their friends and fell on her feet while playing.,What will happen to Aubrey?,bad for Aubrey,pain,have fun,B
32601,"Even though Robin spend the day goofing around, Robin seemed to work hard.",How would Robin feel afterwards?,ambitious,relaxed,like they are getting an unfair deal,B
32602,Jason was holding onto Alex and pulling them. Alex tried to pull away.,Why did Alex do this?,go by themself,go with Jason,be with Jason,A
32603,Jesse covered his car with the little bit of snow off of the ground to take the perfect picture.,Why did Jesse do this?,wanted to show the snow off,wanted to be able to drive the car,look at the car,A
32604,"Tracy felt terrible about what had happened at the party and wanted to make amends, because Tracy knew they had really hurt Robin.",What does Tracy need to do before this?,needed to go back to the party,needed to hurt Robin,needed to ask for forgiveness,B
32605,Ash was running low on milk and decided to go grocery shopping.,Why did Ash do this?,look for milk,wanted to stay home,wanted to eat some cereal,C
32606,"After sparking a friendly and fun conversation, Jan established a good relationship with Ash.",How would Ash feel as a result?,would be happy to have met Jan,amicable,would be happy to have an old friend,A
32607,Quinn's grandmother had passed away after a long illness.,How would Quinn feel afterwards?,a humble person,a nice person,hopeless,C
32608,Jesse kept their cards close to their chest. Jesse could not be trusted.,What will Jesse want to do next?,knows everyone cheats,doesn't trust anyone,lie to others,C
32609,tracy got hired as a employee so he served the tables well.,What will Tracy want to do next?,keep serving the tables,quit serving the tables,annoy the customers,A
32610,Addison checked Skylar's car for her phone after realizing she could not find it anywhere.,What will Skylar want to do next?,look for her phone next,check her backpack,eat dinner next,B
32611,Sydney told Bailey's grandma she always wanted to be in a parade.,How would Bailey feel as a result?,Like they had a conversation with their grandma,Like they thought about their grandma,performative,A
32612,Casey thoroughly enjoyed the meal. The reviews were right about the place.,How would you describe Casey?,a foodie,happy about his meal,doesn't care about food,A
32613,"Cameron performed for the very first time at a comedy club. Thankfully, Cameron was really funny.",How would Cameron feel afterwards?,upset and embarrassed,elated and accomplished,down and depressed,B
32614,Sasha dropped their engagement ring in the Quarry so Sasha spent the day digging around the quarry but sadly to no avail.,What does Sasha need to do before this?,cry to herself,lose their ring,go to the dentist,B
