,context,question,answerA,answerB,answerC,correct
30867,Jesse and Sasha just watched a very interesting movie together.,How would Sasha feel as a result?,inactive,responsive,ignored,B
30868,Jan celebrated Aubrey's birthday but Aubrey got mad at her.,How would Jan feel afterwards?,hurt,happy,mad at Aubrey,A
30869,Jan made the decision to leave her family which ultimately broke her heart.,How would Jan feel afterwards?,happy,a black sheep,sad,C
30870,Quinn put gas in the tank just before heading out for a long trip.,Why did Quinn do this?,be fully prepared,drive to a place,make sure they didn't run out of snacks,A
30871,Quinn was applying for a job in the place Cameron worked so Cameron gave Quinn a couple of words and tips of advice.,What will Quinn want to do next?,cancel the interview,show their weaknesses in the interview,go to the interview,C
30872,Carson offered the resident a job since he just moved into town.,How would you describe Carson?,a good person,like they have a new employee,ask him for help,A
30873,Jesse lost every game and the others went home disappointed that they lost their bets.,What will happen to Others?,The others will collect their money,The others will not bet on Jesse anymore,The others will celebrate,B
30874,Carson filled Cameron's shoes with the details about the big meeting.,What will Carson want to do next?,smart,bored,lazy,A
30875,Alex had Quinn by the balls after Quinn tackled him on the field.,What does Alex need to do before this?,be alone on the field,win the game,be attacked by Quinn,C
30876,Carson felt proud that he was finally growing tall like his father.  He was hoping that we would end up even taller than him/.,How would Carson feel afterwards?,sad,excited,left out,B
30877,Riley used Remy's words to explain in more detail how they were feeling.,What will Riley want to do next?,thank Riley for the words,have their feelings acknowledged,have their feelings hidden,B
30878,Kendall had a party at Jordan's house but was found out to not have asked and just broke in.,How would Kendall feel afterwards?,guilty,thrilled,blessed,A
30879,Casey thought she would be late to work when her chain broke but Kendall got Casey's bike fixed.,What will happen to Casey?,be on time to work,miss her shift at work,still have a broken bike,A
30880,Sydney's dog attacked another dog while they were on a walk.,What will Sydney want to do next?,have the dog trained,not have the dog disciplined,pull their dog away,C
30881,Aubrey field the swimming pool with water so her kids could splash around in it.,What does Aubrey need to do before this?,Air it up,be happy,watch her kids swim,A
30882,Skylar wants to plant a new garden for the season. He is working on the garden this month.,What does Skylar need to do before this?,plant,call his friend who races cars,go buy a tomato,A
30883,Robin took the money to the counter and paid everyone's bill for them.,How would Robin feel afterwards?,helpful afterwards,guilty afterwards,selfish afterwards,A
30884,Jordan told Riley's boyfriend later that Riley was cheating on them.,What does Jordan need to do before this?,make sure that Riley was actually cheaing on their boyfriend,pull a prank on Riley's boyfriend to show he's untrustworthy,cheat on his own partner first,A
30885,Aubrey made some breakfast for everyone that was in their home.,What does Aubrey need to do before this?,go to the store,buy a coat,be nice,A
30886,"Quinn was away from home. But, after six months in London, two months in Paris, and three grueling weeks on the ship, Quinn would soon be back in familiar surroundings.",How would Quinn feel afterwards?,apathy about the recent school board election,anxious about the birth of the foal,relieved and grateful,C
30887,Kendall was away at college and found out their father was sick and might not make it through the night. There were no flights until morning so they drove home.,Why did Kendall do this?,Make it before he passed away,See their grandfather who might pass away that night,Wait for a flight to be available,A
30888,"Sasha plays on a baseball team and, hoping to win, went to the team's first game.",What does Sasha need to do before this?,Drive the coach to practice,Work on individual skills,Buy snacks for the crowd,B
30889,jordan brought the food to sasha at the end of the line because they felt bad for sasha.,How would Sasha feel as a result?,sad about the gesture,annoyed by jordan,grateful towards jordan,C
30890,Jan lost all of Kendall's money at the casino and they were already really low on money for rent.,How would Jan feel afterwards?,very angry,foolish,happy,B
30891,Taylor created a computer program based on Jordan's ideas after weeks of work.,What's the best way to describe Taylor?,a great engineer,angry about it,betrayed by Taylor,A
30892,"Jordan had been at college for months, but he drove home for spring break yesterday.",What does Jordan need to do before this?,great,Pack his things,Talk to his roommate,B
30893,Jordan got in a fight with a friend of his and they never talked again.,What will Jordan want to do next?,stand up for himself,find a new friend,be rude,B
30894,carson was a nice person so he had no problem sharing his gifts with others.,What will Others want to do next?,resent carson,appreciate carson,hate carson,B
30895,"It was a bright and sunny morning, so Taylor decided to not take the train.",How would you describe Taylor?,a person who loathes exercise,a person who hates hiking,a person who likes to exercise,C
30896,Carson decided he wanted a new start and moved to another state.,How would Carson feel afterwards?,scared to start fresh,ready to start over,tired of the old place,B
30897,Sasha expressed Skylar's thoughts in terms of appreciation and benevolence.,What does Sasha need to do before this?,ignore them,forget the thoughts,make them coherent,C
30898,Austin punched Alex in the face on accident and they were sorry about it.,How would Austin feel afterwards?,proud of the mistake,guilty about the punch,happy about the punch,B
30899,Cameron told Tracy they would take it even though their house was already overlowing.,How would Cameron feel afterwards?,a bit of remorse,friendly,helpful,A
30900,Cameron asked Casey to write a recommendation letter to help her get a good job.,What will happen to Cameron?,get a new job,write the letter,get in trouble,A
30901,Tracy was at work and they needed to get things done so she obeyed Skylar's orders.,How would Tracy feel afterwards?,practical,diligent,Like they were doing their job,A
30902,Jordan hid the money they stole from their parents under their pillow.,What will happen to Jordan?,keep it a secret,admit it to their parents,tell their parents,A
30903,Kai turned out pretty well and got a big promotion at the job.,How would Kai feel afterwards?,passive now,proud now,lazy now,B
30904,taylor wanted to help kai so he helped him lose weight.,Why did Taylor do this?,create a fitness and diet plan,ask Taylor what his weight loss goals are,be nice,C
30905,Sasha remained quiet throughout the game and let everyone else participate instead.,Why did Sasha do this?,over,sit out this round of the game,make sure she understood the rules of the game,B
30906,Sasha saved the mother's eggs so that she could cook them for breakfast.,What does Sasha need to do before this?,needs a tv,have a chicken,Make hash browns,B
30907,Jesse thanked the foundation for the grant she needed to apply to her environmental project.,What does Jesse need to do before this?,needed to know the grant,distribute the grant,start their environmental project,C
30908,Remy loved the gift from his mom and really wanted to thank her.,How would Remy feel afterwards?,happy for Remy,Glad to get a gift,like they should think about their mom more,B
30909,Quinn supported their friends work running for office in the town.,Why did Quinn do this?,So their friend had support,hand out campaign fliers,help their friend campaign,A
30910,Ash got Cameron's towel for him after working out in the gym.,Why did Ash do this?,dry off,help him,rest and hydrate,B
30911,Skylar had to tell Kendall a secret so they tilted Kendall's head back and whispered a secret.,What will happen to Skylar?,tell Kendall more secrets,have told a secret,tell others the secret,B
30912,Jordan finally saw the new bakery in town they had been wanting to try.,How would Jordan feel afterwards?,Like they should try the bakery out,eager to try out new places,curious about new things,A
30913,Jan the dog peed next to Austin so Austin put the dog outside.,What will happen to Austin?,go get ice cream,clean the mess,cheer at the situation,B
30914,"Lee caught Ash cheating with another man, so Lee beat Ash to death.",How would you describe Lee?,hurt,happy,excited,A
30915,Ash asked Casey anything about the weather for this week.,Why did Ash do this?,lazy,make appropriate vacation plans,smart,B
30916,casey wanted something sweet so he started baking cookies.,What does Casey need to do before this?,ignore the cookie dough,gather cookie dough,share the cookies,B
30917,"Remy did not have the courage to do his own dirty work, so he let Addison do it for him.",What does Addison need to do before this?,be asked to do the dirty work,wanted to help out Remy because they were friends,spend the money that Remy offered for the job,B
30918,Sasha ate cheeseburgers and then reached for her drink.,What will Sasha want to do next?,sleep next,eat more next,needed to open the mouth,B
30919,Addison had been in school for years and finally graduated from college.,How would you describe Addison?,very happy,a diligent student,a lazy person,A
30920,Sydney noticed that her dogs were fighting and biting each other so she kept the dogs apart.,What will happen to Sydney?,they will commend them on a good job,they will think they are a good dog owner,put the dogs in different rooms,B
30921,Tracy thought they might want to eat so they spend a lot time cooking in the kitchen.,What will Tracy want to do next?,drop plates,make the food,drop food,B
30922,Casey stayed up all night and found a solution to the problem.,How would you describe Casey?,hard working,stupid,lazy,A
30923,"Skylar promised others they would eat lunch together, but Skylar ate lunch with their family instead.",What will Others want to do next?,tell a white lie,make a dinner date with Skylar again soon,scold Skylar for going back on their promise,C
30924,Kendall invited Kai to stay in their house for a few day.,What will happen to Kai after this invitation?,ignore the invitation,answer the invitation,move into the house,B
30925,Jan decided to learn swimming but kept failing. Jan started another round.,How would you describe Jan?,determined,dumb,innocent,A
30926,Sydney served their favorite foods.,What will Sydney want to do next?,clean up the mess,wanted a special dinner,wanted to eat something delicious,A
30927,"Sasha recently had surgery and to avoid infection, Sasha was told not to touch oneself.",What will Sasha want to do next?,Expose the area to the air,Be very cautious of the area,Disregard the advice,B
30928,Quinn and his friends were talking about the new race car out. Quinn owned one and wanted to show it off.,How would Quinn feel afterwards?,proud,boastful,upset,A
30929,Lee brought forth the wallet and returned the money along with it.,How would Others feel as a result?,suspicious of him,very thankful,angry and cheated,B
30930,Aubrey had heard about a lot of robberies in the area so Aubrey protected their property.,What does Aubrey need to do before this?,Secure doors and windows,get a gun,get security cameras,C
30931,Tracy paid Remy back promptly for the loan she gave her previously.,How would you describe Tracy?,unreliable,reliable,irresponsible,B
30932,Casey fought another person in the streets and the violent disturbed everyone.,What will others want to do next?,watch the fight,go home,call the police,C
30933,Austin was helping Carson and Austin had to so something then went back to Carson.,What will Carson want to do next?,has to be distracted,get their work done,talk about work being done,B
30934,Skylar spent time with Remy's family by getting some food and drinks that day.,Why did Skylar do this?,get permission to go spend time with Remy's family,proud,get some money to get food and drinks that day,A
30935,Remy took Skylar money so that they could be able to get a new laptop.,What will Remy want to do next?,talk with Skylar,wanted to be of assistance,wanted to help Skylar,C
30936,"Tracy was not very good at playing poker, so Tracy tipped his hand.",What will Tracy want to do next?,decide their new strategy,fold,challenge the winner,B
30937,Taylor impressed upon Casey the rules of the game so he would know them.,What will Others want to do next?,follow the rules,break the rules,learn the rules of the game,A
30938,Addison took my book a long time ago for the art class.,How would Addison feel afterwards?,careless,Uncaring,selfish,C
30939,Jordan returned back home after a long day at work.,Why did Jordan do this?,finish work,never relax after a hard day,go home and relax,C
30940,Sydney developed a landscaping plan but decided to amend it further.,How would Sydney feel afterwards?,upset that she finished,happy to complete it,angry at her clients,B
30941,Austin played a game in the world championships and they unfortunately messed up making their team lose.,What will Austin want to do next?,avoid seeing people,celebrate the loss,gloat about losing,A
30942,jesse was a reasonable person so he made sure to thank bailey's friends for the support.,What will Bailey want to do next?,thank jesse,praise Bailey's friends,do something for Bailey's friends,A
30943,Riley gave Dan some chocolate as a gift for Valentines Day.,Why did Riley do this?,be Dan's valentine,share chocolate with Dan,be nice,A
30944,Ash cooked dinner for his girlfriend so do something nice for them.,How would Ash feel afterwards?,Like they should of cooked them dinner,Glad they did something nice for them,a warm and nice person,B
30945,"Even though their boss gave them a difficult project, Austin reached their goals before deadline.",What does Austin need to do before this?,work very slowly,concentrate on the project,keep up the good work,B
30946,Tracy wore makeup to the wedding that matched their formal dress because they were a bridesmaid.,Why did Tracy do this?,For the wedding to go well,wear a different dress to the wedding,do what the bride told her,C
30947,"It was time for Kai to go home, but Sydney wanted Kai to stay over.",How would Kai feel as a result?,Rejected,Sad,Liked,C
30948,Austin get into his car and drove the long way home at noon.,Why did Austin do this?,go shopping,eat lunch,drive around town,B
30949,Remy put Jan's toy away because they were done playing.,Why did Remy do this?,put away toys,do nothing,be bored,A
30950,casey went to the store with cameron's father to help them pick out a gift for the party.,What will happen to Cameron?,be thanked,be ignored,be hated,A
30951,Addison wrote the script and made Austin act silly.,What does Addison need to do before this?,tear up the script,throw the script away,give the script to Austin,C
30952,"Kendall loved horror movies, so he attended the Horror Film Festival with friends.",What will Others want to do next?,get autographs from famous horror actors,bored,go to a comedy show instead,A
30953,Aubrey arranged Alex's interview for the associate marketer position.,How would Alex feel as a result?,Bored,Disappointed,Accomplished,C
30954,"Remy represented Skylar's interests in the case, and eventually it went to trial.",What will Remy want to do next?,prepare Skylar,abandon Skylar,tamper with the witness list,A
30955,Remy taught the pet to think about things before it acted on them.,How would Remy feel afterwards?,like they are accomplished,upset at the animal,like they know nothing,A
30956,"Alex was riding his bike when he saw a dirt road, so Alex went down that road.",How would you describe Alex?,brave,boring,lazy,A
30957,Carson was bowling with friends and had lost another round.,How would you describe Carson?,sad over the loss,disappointed,losing at bowling,C
30958,Lee mad Quinn's approach down the ski slopes seem trivial in comparison to his black diamond moves.,What will Quinn want to do next?,go eat lunch,take the day off,learn from Lee,C
30959,Jordan opened the envelope and announced the winner.,How would Jordan feel afterwards?,very angry,excited and thrilled,very pissed off,B
30960,Riley was really hard on Aubrey that day after she kept failing to get the ball in.,Why did Riley do this?,play ball with Aubrey,be a good ball player,wanted to make Aubrey skillful,C
30961,"On his first day as a police officer, Skylar gave the man a speeding ticket.",What does Skylar need to do before this?,Call and ask for backup,Complete Police Academy,Ask the driver if he was okay,B
30962,Alex went back and forth on whether or not to fire the girl for be late all the time.,What will Alex want to do next?,make a decision,was unsure of what to do,give the girl their first bonus,A
30963,"Austin and Taylor had not met for a long time, they met during Christmas.",How would Austin feel afterwards?,never there,a bad friend,embarrassed for the hug,C
30964,carson was a reasonable person so he placed the problem in perspective.,Why did Carson do this?,annoy others,show both sides of the story,cause problems,B
30965,"After lunch, supervisor Remy called me into the office. He said I was getting a raise and promotion for the quality of my work.",What will happen to the others?,be happy that their new supervisor was once a colleague,throw a pity party and pitch in on a gift,be happy that their new supervisor was never a colleague,A
30966,Skylar took several hours to make sure their paper was formatted correctly before turning it in.,How would you describe Skylar?,a person who likes to almost miss deadlines,a person who makes careless mistakes,a person one can trust to do things right,C
30967,Lee divided the money that was made at their store between themselves and Alex.,What will happen to Lee?,get accused of stealing,get thanked by Alex,go spend it all in one place,B
30968,Quinn had never met Kendall's family before and Kendall invited everyone to a dinner.,How would Kendall feel as a result?,cooking dinner,Like Quinn could of done well,Excited for the dinner,C
30969,Bailey bought their friend a ticket to the show and they had fun.,What will Bailey want to do next?,go to the zoo,go to the show,buy a goat,B
30970,Ash got Cameron's towel for them when they were at the beach swimming.,What will Cameron want to do next?,talk about the beach,have fun,find the towel,B
30971,Sasha told their friends a secret that Jan had told them and wanted them to not tell anyone else.,How would you describe Sasha?,a person who Jan will be mad at,closer to Sasha,closer to Jan,A
30972,Aubrey and Addison were friends but Aubrey burnt the bridge between them.,What will happen to Aubrey?,move on and find new friends,lose their friendship Addison,stop their friendship with Aubrey,B
30973,Casey orders fried okra and makes sure to get enough for the others as well.,What will happen to Others?,The others will thank her next,have a good lunch with the others,The others will be sad next,A
30974,Bailey took the matter into their own hands and got the person's money back for them.,How would Others feel as a result?,Others would be impressed with Bailey's assertiveness,someone who takes the bull by the horns,Others would be angry at Bailey's help,A
30975,Kendall borrowed money to buy something that was not very important.,How would you describe Kendall?,ashamed about borrowing money,a person who likes to take advantage of others,guilty about the purchase,C
30976,Sydney carried the message forward by calling the next person in the phone chain.,How would Sydney feel afterward making the call?,person in the phone chain,like she missed the message,like she followed the rules,C
30977,Riley was helping Sasha get dressed in the morning. Riley pulled the wool over Sasha's head.,What does Riley  to do before this?,have a good time,be beside Sasha,help their friend,B
30978,Sasha made decisions for Remy because she was so young.,What does Sasha need to do before this?,confirm how Remy feels,research ideas,Be a bad mother,B
30979,Jordan wanted some candy to munch on. Jordan quickly got some from the kitchen.,How would you describe Jordan?,Full,a greedy person,a reliant person,B
30980,Taylor gave his word to the group but broke it later when he was under duress.,How would you describe Taylor?,bad about breaking his word,a loyal friend,break under pressure,C
30981,Remy reduced his shed to rubble to get rid of it.,How would Remy feel afterwards?,Accomplished,resourceful,Like a lazy person,A
30982,Robin married Alex's cousin and they had a big wedding and reception.,How would you describe Robin?,As someone that talked to Alex's cousin,As someone that had a wedding,happy,B
30983,Alex left the person behind when they ran to get in line for the ride.,Why did Alex do this?,be asked about the ride,be excited,be silly,B
30984,Sydney gave Ash a compliment when she saw him at the store.,What will Ash want to do next?,likes to compliment others,thank Sydney,a good person,B
30985,Kendall went against the grain and did what is right.,What will Others want to do next?,tell them they did good,pick the right option,ask about what they do,A
30986,"Alex was simply another kid on the outside, but secretly wanted to punch people.",Why did Alex do this?,'re passive,'re violent,have good humor,B
30987,"Addison told Jan to leave Addison alone, but Jan followed Addison home and insisted on coming inside.",What will Addison want to do next?,ignore Addison's wishes,report Jan to the police,offer to cook Jan dinner,B
30988,Quinn taught a ceramics class and showed Casey how to form a clay pot.,What will Casey want to do next?,fire their pot,quit the class,teach others,C
30989,casey wanted to be nice to ash so she got ash's car fixed.,How would Ash feel as a result?,unsatisfied,content,angry,B
30990,Robin hit the rocks today and got comfy in her giant and fluffy bed.,How would Robin feel afterwards?,bored,rested,tired,B
30991,Carson wrote Ash's letter to the college for admission.,How would Carson feel afterwards?,uncaring,motivating,very spiteful,B
30992,Sydney actions that they chose to do served the interests of the group.,How would Sydney feel afterwards?,grateful towards Sydney,Like they were used,pleased that Sydney was so selfless,B
30993,Kai shot a deer out back last weekend on Sunday.,What will Kai want to do next?,skin it and cook the meet,leave it there,impress others with his hunting skills,A
30994,Kai climbed to the top of the mountain. It took a long time and a lot of effort.,How would Kai feel afterwards?,sick,indifferent,accomplished,C
30995,sydney prevented a fight from developing and told the principal what happened that day.,What will happen to Others?,be congratulated,are thanked,get in trouble,A
30996,Sydney came home that afternoon to take a short break from work.,What does Sydney need to do before this?,ask for time off,let the dog out,eat a snack,A
30997,Alex lives in Casey's area but really doesn't like Casey at all.,What will Alex want to do next?,find a new place to live,talk to Casey,avoid Alex,A
30998,Sasha liked the dress that Tracy was wearing so she told her that she looks good.,What will Tracy want to do next?,look good,Tell her where she got the dress,Ignore what Sasha was saying to them,B
30999,Cameron was on a budget and need a new shed. Cameron used tools to make it.,Why did Cameron do this?,find the right person to build the shed,have a new shed for a low price,move his tools into the new shed,B
31000,Bailey tried the Remy experiment but found out that it causes serious harm to the experimenter.,What will happen to Bailey?,get criticism,be unharmed,be harmed,A
31001,Jan sat for hours watching the news today as a terrible terrorist attack unfolded.,How would Jan feel afterwards?,devastated,intrigued by the attack,struck with fear,A
31002,Jordan laid gentle eyes upon Ash as she drew closer and closer to him.,How would you describe Jordan?,loving,happy and euphoric,caring,A
31003,Skylar felt confident today and went to work singing a tune.,How would you describe Skylar?,timid,secure,insecure,B
31004,Aubrey heard both sides of the argument and then took the fact into consideration.,What will Aubrey want to do next?,did this to be fair,make a rash decision,best,A
31005,Remy returned the dog to the shop because it was not the breed Remy was expecting.,What will Remy want to do next?,take the dog back home,get the dog,get a new dog,C
31006,Robin recurred at the clinic lab every few weeks for several months.,Why did Robin do this?,Drive to the clinic,go out to lunch with her friend,make sure she did not have an STD,C
31007,"Jesse  out of the country, so she had to put her all life dog up for sale.",How would Jesse feel afterwards?,motivated to move on,sad,it was time for a change,B
31008,Riley pulled them to safety out of the rain.,Why did Riley do this?,thank Riley,keep them from getting cold,compliment Riley,B
31009,"Remy had a long school year, but spring break was over and the end was getting close.",What will Remy want to do next?,start new courses,needed to study for the finals,Take a summer vacation,B
31010,Aubrey filled Riley's tank with fuel at the station after Riley was low on gas.,What will happen to Riley?,regret the gas,be thanked by Riley,ride the car,C
31011,Tracy fought Aubrey's way and Aubrey and Tracy managed to win the war on their own.,What will happen to Tracy?,be arrested for fighting,be awarded a medal of honor,be hailed as the winners of the war,C
31012,Taylor told the teacher that one member of their group will give the speech.,What will Bailey want to do next?,get mad at Joey,decide which member would go,write the speech,B
